{
  "schema": "knowledge-hub.paper.visual-retrieval-hint-usefulness-eval.v1",
  "status": "ready",
  "generatedAt": "2026-05-27T03:38:59Z",
  "decision": "ready_for_targeted_visual_retrieval_hint_search_eval",
  "nextRecommendedTranche": "targeted_visual_retrieval_hint_search_eval",
  "sourceLayoutCandidateReport": {
    "schema": "knowledge-hub.paper.visual-layout-candidate-list-report.v1",
    "status": "ready",
    "candidateRows": 467
  },
  "sourceDryRunReports": [
    {
      "schema": "knowledge-hub.paper.visual-retrieval-hint-candidate-store-dry-run.v1",
      "status": "ready",
      "reportRef": "eval/knowledgeos/reports/visual_retrieval_hint_candidate_store_dry_run.v1.json",
      "dryRunRows": 18,
      "blockedRows": 0,
      "candidateStoreWriteRows": 0
    },
    {
      "schema": "knowledge-hub.paper.visual-retrieval-hint-candidate-store-expansion-dry-run.v1",
      "status": "ready",
      "reportRef": "eval/knowledgeos/reports/visual_retrieval_hint_candidate_store_expansion_dry_run.v1.json",
      "dryRunRows": 24,
      "blockedRows": 0,
      "candidateStoreWriteRows": 0
    },
    {
      "schema": "knowledge-hub.paper.visual-retrieval-hint-candidate-store-expansion-dry-run.v1",
      "status": "ready",
      "reportRef": "eval/knowledgeos/reports/visual_retrieval_hint_candidate_store_expansion_dry_run_003.v1.json",
      "dryRunRows": 24,
      "blockedRows": 0,
      "candidateStoreWriteRows": 0
    }
  ],
  "scope": {
    "writes": "report_only",
    "apiCalls": false,
    "modelCalls": false,
    "webModelCalls": false,
    "inputHintRows": 66,
    "candidateStoreWriteRows": 0,
    "vectorIndexing": false,
    "indexEligibleRows": 0,
    "runtimeVisibleRows": 0,
    "strictEvidencePromotionRows": 0,
    "runtimeAnswerVisibleExposureRows": 0,
    "databaseMutationRows": 0,
    "indexMutationRows": 0,
    "reindexOrReembedRows": 0,
    "vaultScanRows": 0,
    "externalDownloadRows": 0,
    "answerabilityGateBypassRows": 0,
    "searchIndexQueryRows": 0,
    "answerGenerationRows": 0
  },
  "policy": {
    "evalKind": "in_memory_proxy_only",
    "allowedUse": "retrieval_hint_utility_estimation_only",
    "doesNotUseOperationalIndex": true,
    "doesNotWriteCandidateStore": true,
    "doesNotPromoteEvidence": true,
    "strictEvidence": false,
    "citationGrade": false,
    "answerableWithoutTextEvidence": false,
    "runtimeVisible": false,
    "indexEligible": false
  },
  "method": {
    "name": "in_memory_text_only_vs_visual_hint_lexical_proxy_v1",
    "description": "Builds an in-memory text-only corpus from layout candidate textContext and an augmented corpus that appends visual retrieval hints for validated hint rows, then compares target rank for visual-hint-derived probe queries.",
    "limitations": [
      "This is not an operational vector-index or answer-quality evaluation.",
      "Probe queries are generated from visual hints, so results estimate potential recall lift rather than real user success.",
      "A later targeted search eval is required before scaling or indexing."
    ]
  },
  "counts": {
    "sourceDryRunReportRows": 3,
    "layoutCandidateRows": 467,
    "inputHintRows": 66,
    "evaluatedRows": 66,
    "highUsefulnessRows": 63,
    "mediumUsefulnessRows": 3,
    "lowUsefulnessRows": 0,
    "textOnlyTop5Rows": 0,
    "augmentedTop5Rows": 66,
    "rankImprovedRows": 66,
    "duplicateSourceCandidateIdRows": 0,
    "blockedRows": 0,
    "candidateStoreWriteRows": 0,
    "indexEligibleRows": 0,
    "runtimeVisibleRows": 0,
    "strictEvidenceRows": 0,
    "citationGradeRows": 0,
    "answerableWithoutTextEvidenceRows": 0,
    "privatePathLeakRows": 0,
    "schemaViolationCount": 0
  },
  "typeSummary": [
    {
      "candidateType": "equation_region",
      "rows": 13,
      "highUsefulnessRows": 13,
      "mediumUsefulnessRows": 0,
      "lowUsefulnessRows": 0,
      "augmentedTop5Rows": 13,
      "textOnlyTop5Rows": 0
    },
    {
      "candidateType": "figure_caption_region",
      "rows": 24,
      "highUsefulnessRows": 23,
      "mediumUsefulnessRows": 1,
      "lowUsefulnessRows": 0,
      "augmentedTop5Rows": 24,
      "textOnlyTop5Rows": 0
    },
    {
      "candidateType": "image_region",
      "rows": 8,
      "highUsefulnessRows": 8,
      "mediumUsefulnessRows": 0,
      "lowUsefulnessRows": 0,
      "augmentedTop5Rows": 8,
      "textOnlyTop5Rows": 0
    },
    {
      "candidateType": "layout_region",
      "rows": 4,
      "highUsefulnessRows": 4,
      "mediumUsefulnessRows": 0,
      "lowUsefulnessRows": 0,
      "augmentedTop5Rows": 4,
      "textOnlyTop5Rows": 0
    },
    {
      "candidateType": "table_region",
      "rows": 17,
      "highUsefulnessRows": 15,
      "mediumUsefulnessRows": 2,
      "lowUsefulnessRows": 0,
      "augmentedTop5Rows": 17,
      "textOnlyTop5Rows": 0
    }
  ],
  "evalRowsDetail": [
    {
      "schema": "knowledge-hub.paper.visual-retrieval-hint-usefulness-eval-row.v1",
      "evalRowId": "visual-retrieval-hint-usefulness:4bf35391974500b20497",
      "hintCandidateId": "visual-retrieval-hint:alexnet-2012:figure_caption_region:3:7533b25075b8dd07",
      "sourceCandidateId": "visual-layout:alexnet-2012:figure_caption_region:3:5e4d346d4c7b2c53",
      "paperId": "alexnet-2012",
      "paperRef": "papers_dir/4824-imagenet-classification-with-deep-convolutional-neural-networks.pdf",
      "sourceContentHash": "sha256:90137160c57217953d5f61857e64ca58e85f06e1b13b4f475c918b1b582b9771",
      "page": 3,
      "bbox": [
        333.92,
        272.94,
        504.0,
        403.21
      ],
      "candidateType": "figure_caption_region",
      "sourceDryRunReportRef": "eval/knowledgeos/reports/visual_retrieval_hint_candidate_store_dry_run.v1.json",
      "textOnlyContext": {
        "charCount": 847,
        "tokenCount": 49,
        "hasCaptionText": true
      },
      "visualHint": {
        "derivedTextCharCount": 203,
        "visibleTextCharCount": 140,
        "retrievalKeywordCount": 10,
        "novelRetrievalKeywordCount": 2,
        "novelVisualTokenCount": 10,
        "novelVisualTokenSample": [
          "alexnet",
          "area",
          "axes",
          "comparing",
          "curves.",
          "epochs",
          "fragments",
          "networks",
          "regularization.",
          "training-error"
        ]
      },
      "proxyProbe": {
        "query": "alexnet epochs area training-error comparing networks axes curves.",
        "textOnlyRank": null,
        "augmentedRank": 1,
        "rankDelta": 467,
        "textOnlyScore": 0.0,
        "augmentedScore": 52.031293,
        "textOnlyTop5Hit": false,
        "augmentedTop5Hit": true
      },
      "usefulness": {
        "tier": "high",
        "recommendation": "prioritize_for_targeted_search_eval",
        "reason": "visual hint adds novel query terms and moves the target into the top retrieval band"
      },
      "policy": {
        "allowedUse": "retrieval_hint_utility_estimation_only",
        "strictEvidence": false,
        "citationGrade": false,
        "answerableWithoutTextEvidence": false,
        "runtimeVisible": false,
        "indexEligible": false
      },
      "blockerReason": ""
    },
    {
      "schema": "knowledge-hub.paper.visual-retrieval-hint-usefulness-eval-row.v1",
      "evalRowId": "visual-retrieval-hint-usefulness:549f91feeece9f130126",
      "hintCandidateId": "visual-retrieval-hint:alexnet-2012:equation_region:4:599abe7d6fb2a0e3",
      "sourceCandidateId": "visual-layout:alexnet-2012:equation_region:4:f9d505b3e6aabed6",
      "paperId": "alexnet-2012",
      "paperRef": "papers_dir/4824-imagenet-classification-with-deep-convolutional-neural-networks.pdf",
      "sourceContentHash": "sha256:90137160c57217953d5f61857e64ca58e85f06e1b13b4f475c918b1b582b9771",
      "page": 4,
      "bbox": [
        211.09,
        185.62,
        262.24,
        199.82
      ],
      "candidateType": "equation_region",
      "sourceDryRunReportRef": "eval/knowledgeos/reports/visual_retrieval_hint_candidate_store_dry_run.v1.json",
      "textOnlyContext": {
        "charCount": 427,
        "tokenCount": 45,
        "hasCaptionText": false
      },
      "visualHint": {
        "derivedTextCharCount": 211,
        "visibleTextCharCount": 137,
        "retrievalKeywordCount": 11,
        "novelRetrievalKeywordCount": 9,
        "novelVisualTokenCount": 22,
        "novelVisualTokenSample": [
          "a_i_xy",
          "adjacent",
          "alexnet",
          "alpha",
          "b_i_xy",
          "beta",
          "beta.",
          "containing",
          "defined",
          "denominator",
          "equation",
          "fragments"
        ]
      },
      "proxyProbe": {
        "query": "alexnet equation response lrn response-normalized b_i_xy a_i_xy maps alpha beta",
        "textOnlyRank": null,
        "augmentedRank": 1,
        "rankDelta": 467,
        "textOnlyScore": 0.0,
        "augmentedScore": 81.598476,
        "textOnlyTop5Hit": false,
        "augmentedTop5Hit": true
      },
      "usefulness": {
        "tier": "high",
        "recommendation": "prioritize_for_targeted_search_eval",
        "reason": "visual hint adds novel query terms and moves the target into the top retrieval band"
      },
      "policy": {
        "allowedUse": "retrieval_hint_utility_estimation_only",
        "strictEvidence": false,
        "citationGrade": false,
        "answerableWithoutTextEvidence": false,
        "runtimeVisible": false,
        "indexEligible": false
      },
      "blockerReason": ""
    },
    {
      "schema": "knowledge-hub.paper.visual-retrieval-hint-usefulness-eval-row.v1",
      "evalRowId": "visual-retrieval-hint-usefulness:c45765e315f2f9505764",
      "hintCandidateId": "visual-retrieval-hint:alexnet-2012:equation_region:4:044989cbca13e1ab",
      "sourceCandidateId": "visual-layout:alexnet-2012:equation_region:4:79cf21420d190e08",
      "paperId": "alexnet-2012",